Thứ hạng,Tên Phim,Đạo diễn,Doanh Thu,Năm,Nội dung,Nhóm,cluster
41,Avengers: Đế chế Ultron,Joss Whedon,124,2015,"Nhân dịp Thor đến Trái Đất lần thứ ba, Biệt đội Avengers mời anh cùng tấn công căn cứ của HYDRA tại một nước Đông Âu là Sokovia. Chỉ huy căn cứ này là Baron Strucker - kẻ đang tiến hành thí nghiệm trên cơ thể con người bằng cây quyền trượng của Loki. Đội Avengers chạm trán hai thí nghiệm của Strucker - cặp anh em sinh đôi nhà Maximoff, Pietro có siêu tốc độ còn Wanda có khả năng điều khiển tâm trí và phóng ra năng lượng bằng tay. Biệt đội Avengers đã bắt được Strucker và Tony Stark lấy lại cây quyền trượng của Loki. Nhưng lúc ấy Wanda sử dụng ảo giác cho Stark thấy một cảnh tượng đáng sợ - một đội quân Chitauri còn đông hơn trong phần một xâm lược Trái Đất, và cả đội Avengers bị hạ gục trừ anh. Stark và Bruce Banner đã khám phá ra trí tuệ nhân tạo bên trong viên đá của cây quyền trượng và bí mật sử dụng nó để hoàn thiện dự án phòng thủ toàn cầu ""Ultron"" của Stark. Nhưng Ultron lại có khả năng tự nhận thức, tin rằng hắn phải tiêu diệt tận gốc loài người để bảo vệ Trái Đất, nên hắn đã vô hiệu hoá J.A.R.V.I.S. và tập kích Biệt đội Avengers ngay tại tháp Avengers[a]. Sau khi đem cây quyền trượng trốn thoát, Ultron đã sử dụng những cơ sở trong căn cứ của Strucker để tạo ra một cơ thể thực sự cho hắn. Giết Strucker xong, Ultron đã kết nạp anh em nhà Maximoff - những người muốn Stark phải chịu trách nhiệm cho cái chết của bố mẹ họ vì vũ khí của tập đoàn Stark. Họ cùng nhau đến gặp tay buôn lậu vũ khí Ulysses Klaue tại một xưởng đóng tàu ở châu Phi để mua Vibranium của vương quốc Wakanda. Các siêu anh hùng liền đuổi theo nhưng Wanda đã khống chế được họ (trừ Stark và Clint Barton) bằng ảo giác, làm Hulk nổi điên lên đập phá thành phố buộc Stark phải triệu hồi Veronica sử dụng bộ giáp khổng lồ Hulkbuster (Mark 44) để kìm hãm anh. Phản ứng dữ dội của dư luận thế giới và hậu quả từ nỗi sợ ảo giác của Wanda đã buộc các siêu anh hùng phải ẩn náu tại nhà riêng của Barton. Thor đã đi gặp Tiến sĩ Erik Selvig để xem kỹ tương lai tận thế trong ảo giác của anh, trong khi đó Natasha Romanoff và Banner lên kế hoạch cùng nhau bỏ đi thật xa sau khi nhận ra sự hấp dẫn của nhau. Mặc dù vậy, Nick Fury đã đến để khuyến khích toàn đội lên kế hoạch ngăn chặn Ultron. Ở Seoul, Ultron đã khống chế Tiến sĩ Helen Cho để sử dụng công nghệ sợi tổng hợp của cô cùng với Vibranium và viên đá của cây quyền trượng để hoàn thiện cơ thể mới cho hắn. Khi Ultron đang tải hắn vào cơ thể mới, Wanda đã đọc được tâm trí của hắn và biết được âm mưu tiêu diệt loài người của hắn. Hai anh em nhà Maximoff trở mặt chống lại Ultron. Steve Rogers, Romanoff và Barton truy tìm Ultron để giành lại cơ thể tổng hợp, nhiệm vụ hoàn thành nhưng Ultron đã bắt được Romanoff. Kế hoạch ban đầu thất bại khiến Ultron đành tự tạo cơ thể khác bằng Vibranium, song vẫn tạo ra đội quân bản sao tay sai như dự định. Hệ điều hành J.A.R.V.I.S. - vẫn còn hoạt động sau khi trốn thoát khỏi Ultron vào Internet, Tony và Bruce tải nó vào cơ thể tổng hợp. Nhưng Rogers và anh em nhà Maximoff tìm cách ngăn cản việc này vì nghe theo lời Wanda, cho rằng Stark sẽ lặp lại sai lầm cũ. Giữa cuộc hỗn chiến, Thor trở lại để giúp kích hoạt cơ thể tổng hợp, tạo ra Vision, giải thích rằng viên đá trên trán nó là Viên đá Tâm Trí - một trong sáu Viên đá Vô Cực - những vật thể mạnh nhất hiện tại có sức phá hủy vũ trụ - và là một phần trong ảo giác của anh. Vision và anh em nhà Maximoff cùng Biệt đội Avengers đến Sokovia, nơi Ultron tạo ra một cỗ máy để nâng thủ đô Sokovia là Novi Grad lên trời, rồi sẽ làm nó rơi xuống mặt đất để hủy diệt thế giới. Romanoff sau khi được Banner tìm thấy và giải cứu đã đưa anh vào rừng, đánh thức Hulk. Biệt đội siêu anh hùng chiến đấu với đội quân robot của Ultron trong khi Fury cùng Maria Hill, James Rhodes và các đặc vụ của S.H.I.E.L.D. sơ tán người dân lên phi thuyền Helicarrier. Pietro đã hi sinh khi che chắn cho Barton khỏi làn đạn của Ultron, Wanda giận dữ đối đầu Ultron và moi tim hắn để trả thù cho anh trai, nhưng chính việc tự ý bỏ vị trí của cô đã cho phép Ultron lợi dụng sơ hở điều khiển xác một drone kích hoạt cỗ máy, Novi Grad bắt đầu rơi xuống. Stark và Thor đã kịp tấn công ở cả hai đầu cỗ máy khiến vùng đất này nổ tung. Sau đó, Hulk sợ bản thân mình sẽ gây nguy hiểm cho Romanoff nên anh đã rời đi trên chiếc máy bay Quinjet và mất tích trên bầu trời, trong khi Vision đối mặt với cơ thể suy yếu của Ultron và kết liễu hắn. Sau đó, Biệt đội Avengers đã thành lập một trụ sở mới được điều hành bởi Fury, Hill, Cho, và Selvig. Nghi ngờ kẻ nào đó trong vũ trụ đã thao túng các sự kiện gần đây, Thor tạm trở về Asgard để biết thêm tình hình. Stark và Barton cũng rời đi, Rogers và Romanoff chuẩn bị lãnh đạo một đội siêu anh hùng mới gồm Rhodes, Vision, Sam Wilson và Wanda. Bộ phim kết thúc trong khi Rogers đang nói dở câu: ""Avengers, tập..."" Trong phần cảnh hậu danh đề, không hài lòng với sự thất bại của những quân cờ của mình, Thanos đã đeo chiếc găng tay Vô cực rỗng và quyết định sẽ tự giành lấy những viên đá vô cực.",5,5
42,Siêu lừa gặp siêu lầy,Võ Thanh Hòa,122[36],2023,"Với mong muốn đổi đời, Khoa (Mạc Văn Khoa) – một tên lừa đảo khét tiếng tại Việt Nam đã đến Phú Quốc với mong muốn lừa đảo để kiếm bộn tiền đổi đời. Trong khi thực hiện hành vi lừa đảo, anh đã vô tình gặp được Tú (Anh Tú Atus) – một tên lừa đảo có tổ chức khét tiếng hơn và đã thực hiện được nhiều phi vụ chưa bao giờ thất bại cùng với ông Năm (Trung Lùn) và Mã Lai (Ngọc Phước). Thấy được tiềm năng từ Tú, Khoa đã xin gia nhập băng và đã được Tú đồng ý sau khi nghe Khoa chia sẻ về câu chuyện khó khăn của mình. Tại Phú Quốc, cả băng nhóm đã thành công khi thực hiện nhiều phi vụ lừa đảo sau khi phân tích kỹ càng về điểm yếu của đối tượng rồi từ đó giăng bẫy. Các chiêu thức được thiết lập bằng công nghệ cao như việc cải trang, vượt rào hệ thống an ninh cùng nhiều thủ thuật lừa đảo như diễn kịch lợi dụng tình thương. Cuối cùng cả bọn đã tìm hiểu và gặp được nữ doanh nhân Khánh (Cát Tường) hoạt động được mô tả hoạt động theo mô hình kinh doanh đa cấp và kêu gọi vốn đầu tư. Nhóm của Tú đã thực hiện lừa đảo bà Khánh khi tự nhận là một nhóm tổ chức sự kiện. Tuy nhiên, sau đó sự thật đã bị phơi bày và lộ diện bà Khánh cũng là một kẻ lừa đảo. Ngay sau đó, bà Khánh đã cố gắng bịt đầu mối bằng cách truy lùng băng nhóm của Tú để tránh việc phanh phui sự thật của mình. Cuối cùng, nhóm của Tú cũng đã thành công phơi bày bộ mặt thật của bà Khánh khi trên đường cố gắng tẩu thoát sang nước không dẫn độ về Việt Nam cùng số tiền của các nhà đầu tư.",6,1
43,Chị chị em em 2,Vũ Nọc Đãng,121[37],2023,"Câu chuyện của Chị chị em em 2 lấy bối cảnh Sài Gòn những năm đầu thế kỷ 20, kể về hai đại mỹ nhân xưa là Ba Trà (Minh Hằng) và Tư Nhị (Ngọc Trinh). Chuyện phim mở đầu bằng vũng nước dơ vô tình văng ra từ chiếc xe của Ba Trà, khiến Tư Nhị (khi đó vẫn là Nhi gái điếm), nổi đóa. Ba Trà xòa tiền đền chiếc áo cho Tư Nhị nhưng nào có ngờ, từ những đồng tiền này, Nhi quyết tâm đi theo làm ''đệ tử'' của Ba Trà. Nhi đã tìm mọi cách, bày mưu tính kế để tiếp cận Đệ Nhất Mỹ Nhân Sài Thành – Ba Trà nhằm đổi đời. Đầu tiên, Nhi đã lừa Ba Trà rằng mẹ cô bị bắt cóc, buộc cô phải mang tiền đến chuộc lại mẹ của mình, nhưng khi Ba Trà đến khu Bồ Rệt thì vừa bị mất tiền vừa bị quân lính bắt vì không có giấy tờ tùy thân, ngay lúc này Nhi đã đến giải cứu. Sau đó Ba Trà đã trả tiền nợ để giúp Nhi thoát khỏi khu gái điếm vì Nhi đã giải cứu cô ngày hôm qua. Sau khi thoát khỏi khu gái điếm thì Nhi vẫn không được Ba Trà nhận, cô cho Nhi tiền để trở về quê làm ruộng, nhưng lúc đó cô không bỏ cuộc liền nghĩ ra kế hoạch để lấy lòng Ba Trà lần 2. Nhi đã thuê người giả dạng người đánh ghen Ba Trà, thả Ba Trà xuống dưới nước và để Nhi giải cứu. Sự việc tiến triển như mong đợi, cô Ba nhận Nhi làm em gái nuôi, giúp cô gột rửa cái mác thấp hèn và tái sinh trong thân phận Tiểu thư Tư Nhị. Cũng từ đó, cả hai trở thành cặp chị em tình thâm, danh tiếng ngày một thăng hạng kéo theo tiền tài, danh vọng và cả những mưu kế khôn lường nhằm độc chiếm vị trí số một cho mình. Trong một lần bất cẩn, Nhi đã để cho Ba Trà phát hiện ra những kế hoạch trước đây đều do Nhi dàn xếp. Sau đó, Ba Trà đã mời nhà báo đến và nói rằng Tư Nhị trên đường đến Sài Thành không may mắc bệnh đã qua đời, tố Nhi đã lợi dụng điều này, mạo danh Tư Nhị và tiếp cận Ba Trà. Cô Ba còn mời những người trong động Ba Phò và những người biết được quá khứ của Nhi đến để xác thực xem cô có phải là con điếm Nhi không. Nhưng mọi chuyện không như Ba Trà nghĩ, tất cả mọi người đều phủ nhận đây không phải là con điếm Nhi mà là Tư Nhị, (trước đó Nhi đã đi trước Ba Trà một bước, dùng tiền mua chuộc tất cả mọi người để không ai nói rằng cô chính là Nhi ngày xưa). Nhi đã quyết định dùng kế cuối cùng để lật đổ Ba Trà, cô nói chính mắt nhìn thấy Ba Trà chơi ngải quyến rũ các công tử và nói cho mọi người biết cô đang giấu bùa ngải trong phòng ngủ. Từ đó Ba Trà bị thân bại danh liệt và biến mất, Tư Nhị nghiễm nhiên trở thành Đệ Nhất Mỹ nhân Sài Thành. Sau đó, Ba Trà xuất hiện với hai con át chủ bài cuối cùng chính là hai tên lính mà Nhi không tìm thấy dấu vết để mua chuộc. Ba Trà đã bắt cô phải chia 9-1, tức là Tư Nhị kiếm được 10 đồng sẽ phải đưa cho Ba Trà 9 đồng.",1,1
44,Thor: Tình yêu và sấm sét,Taika Waititi,120[38],2022,"Gorr và con gái của hắn, Love, người cuối cùng của chủng tộc của họ, vật lộn trong một sa mạc cằn cỗi. Bất chấp những lời cầu nguyện của họ với vị thần của họ, Rapu, Love vẫn chết. Vũ khí giết thần Necrosword gọi Gorr, dẫn hắn đến vương quốc tươi tốt của Rapu. Sau khi Rapu chế giễu hoàn cảnh của Gorr một cách độc ác, hắn từ bỏ vị thần, khiến Rapu phải bóp cổ hắn ta. Necrosword tự hiến mình cho Gorr, người đã giết Rapu bằng nó và thề sẽ giết tất cả các vị thần. Gorr được ban cho khả năng điều khiển bóng tối và tạo ra quái vật, nhưng bị nguyền rủa với cái chết sắp xảy ra và sự tha hóa dưới ảnh hưởng của thanh kiếm. Sau khi Gorr giết một số vị thần, Thor, người đã tham gia Vệ binh dải ngân hà,[N 2] biết được tín hiệu báo động từ Sif. Anh chia tay đội và tìm thấy Sif đang bị thương, anh ta cảnh báo rằng mục tiêu tiếp theo của Gorr là New Asgard. Trong khi đó, Tiến sĩ Jane Foster, bạn gái cũ của Thor, được chẩn đoán mắc ung thư giai đoạn cuối. Với việc điều trị y tế không hiệu quả, cô đến New Asgard với hy vọng rằng chiếc búa Mjolnir của Thor, thứ đã bị Hela phá hủy trước đó,[N 3] có thể chữa lành cho cô. Do một loại bùa mà Thor vô tình đặt vào nó nhiều năm trước đó để bảo vệ Foster, Mjolnir đã tái trang bị và gắn kết bản thân với cô ấy. Thor đến New Asgard ngay khi cuộc tấn công của Gorr bắt đầu. Thor ngạc nhiên khi thấy Foster sử dụng Mjolnir, nhưng lại hợp tác với cô ấy, Valkyrie và Korg để chống lại Gorr. Cả nhóm ngăn cản Gorr, nhưng hắn trốn thoát, bắt cóc một số trẻ em Asgard và giam chúng trong Cõi Bóng tối. Được thừa hưởng khả năng của người cha đã khuất Heimdall, con trai của ông là Axl liên lạc với Thor, người có thể tương tác với lũ trẻ. Cả nhóm đi đến Thành phố Omnipotence để cảnh báo các vị thần khác và yêu cầu họ giúp đỡ trong việc tạo ra một đội quân. Thủ lĩnh của các vị thần, Zeus, sợ hãi Gorr và không sẵn sàng giúp đỡ, nghĩ rằng họ có thể vẫn an toàn và ẩn mình khỏi Gorr trong Thành phố. Zeus ra lệnh bắt giữ nhóm để ngăn họ tiết lộ vị trí của Thành phố cho Gorr. Khi Zeus làm Korg bị thương, Thor đã đâm chết Zeus bằng lưỡi tầm sét của chính mình mà Valkyrie đã đánh cắp trước khi họ trốn thoát. Khi cuộc hành trình tiếp tục, Thor và Foster khơi lại mối quan hệ lãng mạn của họ và Foster tiết lộ căn bệnh của cô. Cả nhóm đến Cõi Bóng tối nhưng không thể xác định được vị trí của bọn trẻ. Foster nhìn thấy những hình vẽ cổ đại mô tả Stormbreaker như một cách để triệu hồi Bifrost để vào cõi vĩnh hằng và suy ra cái bẫy do Gorr bày ra. Cô ném Stormbreaker đi để ngăn Gorr tiếp cận nó. Tuy nhiên, Gorr áp đảo nhóm và đe dọa giết Foster buộc Thor phải triệu hồi nó trở lại. Trong trận chiến sau đó, Gorr làm Valkyrie bị thương nặng. Cả nhóm trở về Trái đất và Gorr đánh cắp Stormbreaker. Hút hết sức lực của cô ấy mỗi khi sử dụng Mjolnir, Foster được cảnh báo rằng sử dụng nó một lần nữa sẽ có thể giết chết cô ấy. Thor thuyết phục Foster để anh ta chiến đấu với Gorr một mình trong khi cô ấy hồi phục. Thor tìm thấy những đứa trẻ bị bắt cóc tại đền thờ của Eternity và, sử dụng lưỡi tầm sét của Zeus, truyền cho chúng sức mạnh của mình để chống lại quái vật của Gorr trong khi chiến đấu với Gorr. Khi Foster cảm nhận được rằng Gorr sắp giết Thor, cô đã tham gia trận chiến với Mjolnir để cứu anh. Họ phá hủy Necrosword, giải phóng Gorr khỏi ảnh hưởng của nó, nhưng cả ba được đưa vào cõi Eternity. Khi Gorr sẵn sàng thực hiện điều ước của mình, Thor cầu xin Gorr hồi sinh con gái mình thay vì tiêu diệt các vị thần. Thor sau đó để Gorr đưa ra quyết định của mình và chăm sóc Foster, người đã chống chọi với bệnh tật của cô và chết trong vòng tay của anh. Bị xúc động bởi cảnh tượng của họ, Gorr mong muốn Eternity hồi sinh Love, thứ mà nó ban tặng. Khi Gorr chết vì lời nguyền, hắn yêu cầu Thor chăm sóc cho Love. Sau đó, những đứa trẻ trở lại New Asgard, nơi Valkyrie và Sif bắt đầu huấn luyện chúng, và một tượng đài để vinh danh Foster được xây dựng. Thor nhận Love, người đã tham gia cùng anh trong các câu chuyện anh hùng của mình, với Mjolnir trước đây sử dụng và Stormbreaker sử dụng bởi Love. Trong một cảnh mid-credit, trở lại Thành phố Omnipotence, thần Zeus đang hồi phục sức khỏe đã gửi con trai của mình là Hercules để giết Thor. Trong một cảnh post-credit, Foster đến cổng Valhalla, nơi Heimdall chào đón cô.",0,0
45,Thám tử lừng danh Conan: Ngôi sao 5 cánh 1 triệu đô,Tomoka Nagaoka,119[39],2024,"Thông báo từ Kaito Kid đã được gửi tới phòng chứa đồ của Axie Zaibatsu ở Hakodate, Hokkaidō. Mục tiêu của Kid lần này là một thanh kiếm Nhật gắn liền với Toshizō Hijikata, phó chỉ huy của Shinsengumi sống vào cuối thời Edo. Tại sao Kid, người đang theo đuổi Big Jewel, lại nhắm đến thanh kiếm...? Trong khi đó, Hattori Heiji, một thám tử đến từ phương Tây, cùng Conan và những người bạn của anh cũng đang đến thăm Hakodate để tham gia một giải đấu kiếm đạo, và vào ngày nhận được thông báo tội phạm, Heiji đã nhìn thấu lớp ngụy trang của Kid và dồn cậu ta vào góc tường...!? Cùng lúc đó, một thi thể có vết cắt hình chữ thập trên ngực được tìm thấy ở khu nhà kho Hakodate. Cuộc điều tra phát hiện ra một người đàn ông người Mỹ gốc Nhật được mệnh danh là ""Thương gia tử thần"", người hoạt động buôn bán vũ khí khắp châu Á. Anh ta đang tìm kiếm một kho báu được cho là đã được cất giấu ở đâu đó tại Hakodate bởi người đứng đầu đầu tiên của gia tộc Akie, người có liên quan sâu sắc đến ngành quân sự trong chiến tranh. Cũng có tin đồn rằng nó là loại vũ khí mạnh đến mức có thể thay đổi hoàn toàn cục diện cuộc chiến, tưởng chừng như Nhật Bản sẽ bị đánh bại vào thời điểm đó. Dường như có mối liên hệ nào đó giữa kho báu và thanh kiếm mà Kid đang nhắm tới, và khi Kid nhắm đến thanh kiếm thì bóng đen của một ""kiếm sĩ"" bí ẩn lại gần",2,2
46,Người Nhện xa nhà,Jon Watts,117[41],2019,"Tại Ixtenco, Mexico, tám tháng sau sự kiện Đốm sáng,[N 1] Nick Fury và Maria Hill điều tra một cơn bão có khuôn mặt người và chạm trán nó - Nguyên tố Đất. Một nhân vật bí ẩn tên Quentin Beck xuất hiện và đánh bại sinh vật đó. Tại New York, trường Midtown tổ chức năm học bù và chuyến tham quan châu Âu cho những học sinh bị giết trong sự kiện Búng tay. Trong lúc còn đau buồn bởi cái chết của Tony Stark, Peter Parker dự định tỏ tình với Michelle ""MJ"" Jones và từ bỏ việc làm Người Nhện, bao gồm việc bỏ lại bộ đồ Iron Spider do Stark tặng 5 năm trước. Fury cố liên lạc với Peter trong buổi từ thiện của cậu và dì May, nhưng cậu chuyển máy cho Happy Hogan. Trong chuyến tham quan Venice, Ý, Nguyên tố Nước xuất hiện và hoành hành. Peter không ngăn chặn được nó cho đến khi Beck đến. Lần này, Fury trực tiếp gặp Peter và giới thiệu với Beck, nay còn được gọi là Mysterio. Beck giải thích rằng bản thân mình và nhóm Nguyên tố đến từ một vũ trụ khác qua một vết nứt do sự kiện Búng tay tạo ra, còn gia đình anh đã bị nhóm thực thể đó sát hại. Cũng trong cuộc gặp này, Fury giao cho Peter thứ mà Stark để lại cho người kế vị mình: chiếc kính được tích hợp trí tuệ nhân tạo E.D.I.T.H.[N 2], cho phép truy cập vào mạng vệ tinh và điều khiển các drone chiến đấu của Tập đoàn Công nghiệp Stark. Peter chỉ nhận chiếc kính và vẫn từ chối yêu cầu của ông. Fury bí mật đổi hướng địa điểm tham quan tiếp theo sang Praha, nơi Nguyên tố Lửa sẽ tấn công theo lời Beck. Nó xuất hiện tại lễ hội, nhưng bị Peter và Beck hợp sức đánh bại. Fury và Hill mời hai người đến Berlin để bàn việc lập một nhóm siêu anh hùng mới. Peter tin rằng Beck xứng đáng kế vị Stark hơn nên nhường kính E.D.I.T.H. Nhưng cậu không biết rằng, Beck thực chất là một chuyên gia kỹ xảo bị sa thải khỏi Tập đoàn Stark vì bản tính thất thường, mặc dù hắn có lý do chính đáng vì Stark coi thường tiềm năng công nghệ ảo ảnh mà hắn phát minh và đặt tên nó là B.A.R.F.[N 3] Hắn cùng đội của mình, cũng là những cựu nhân viên bất mãn với vị sếp cũ quá cố, đã kết hợp B.A.R.F. với các drone chiến đấu gắn máy chiếu để ngụy tạo các Nguyên tố và biến Beck thành siêu anh hùng mới trong mắt công chúng. Ngay khi Peter định nói lời tỏ tình, MJ ngắt lời cậu bằng việc chỉ ra cậu là Người Nhện, rồi đưa ra bằng chứng quyết định là một thiết bị lạ mà tơ nhện của cậu tình cờ kéo phải trong trận chiến ở lễ hội. Peter cố phủ nhận đến khi họ phát hiện nó là một máy chiếu phát ra ảo ảnh Nguyên tố Khí, cũng như cảnh Beck ""chiến đấu"" với nó, từ đó chứng minh hắn là một kẻ lừa đảo. Peter tức tốc đến Berlin để tố giác với Fury, nhưng bị Beck phục kích bằng hàng loạt ảo ảnh sau khi tìm thấy máy chiếu bị mất. Fury đột ngột xuất hiện và bắn hạ hắn. Peter yên tâm tiết lộ rằng các bạn cậu cũng đã biết bộ mặt thật của Beck, nhưng chính Fury hoá ra cũng là ảo ảnh. Và chưa kịp định thần thì cậu bị Beck lừa tới một tàu hoả đang đến và bị tông trúng. May mắn thay, cậu vẫn sống sót và còn đủ sức để leo vào một toa tàu trước khi ngất đi. Tỉnh dậy trong một nhà tù ở Hà Lan, Peter vượt ngục và liên lạc với Hogan, người đưa Peter đến London giao một cỗ máy sản xuất bộ đồ do Stark để lại, mà Peter sử dụng để tự chế một bộ mới. Tại London, Beck sai E.D.I.T.H. dàn dựng ảo ảnh lớn nhất: hợp thể của cả bốn Nguyên tố, sử dụng nó làm vỏ bọc hòng giết MJ và bất kỳ ai khác mà cô có thể đã tiết lộ bí mật của hắn. Peter phá hủy ảo ảnh, làm lộ bản chất của nó trước mắt mọi người. Máu cầu toàn bốc lên, Beck tức giận điều khiển drone tấn công cậu, ngay cả khi chính hắn ở trong tầm bắn. Cuối cùng, Peter đánh bại Beck và lấy lại chiếc kính để hủy lệnh tấn công. Beck vô tình bị giết chết vì trúng đạn lạc từ drone của chính mình. Một trợ lý của hắn trốn thoát với dữ liệu về trận chiến. Peter trở lại thành phố New York và bắt đầu hẹn hò MJ, trong khi dì May cũng chuẩn bị cho mối quan hệ tương tự với Hogan. Trong cảnh mid credit, ngay khi Peter (đang mặc trang phục Người Nhện) vừa kết thúc buổi hẹn hò với MJ, người dẫn chương trình J. Jonah Jameson của Daily Bugle đã phát sóng cảnh quay bị chỉnh sửa về vụ việc ở Luân Đôn, trong đó Beck tự nhận là đã đẩy lui các Nguyên tố về vết nứt không gian, nhưng rồi bị Người Nhện giết bằng đội quân drone hòng độc chiếm vị thế Người Sắt mới. Trong ""khoảnh khắc cuối cùng"", hắn còn tiết lộ tên thật của Người Nhện là Peter Parker. Còn ở cảnh after credit, Fury và Hill lộ diện lần lượt là Talos và vợ ông là Soren cải trang, theo lệnh của Fury thật, lúc này đang chỉ huy một tàu vũ trụ Skrull ngoài Trái Đất.",5,5
