Thứ hạng,Tên Phim,Đạo diễn,Doanh Thu,Năm,Nội dung,Nhóm,cluster
30,Lật mặt: 48h,Lý Hải,157[25],2021,"25 năm trước, nhà Hiền bị kẻ trộm đột nhập và cướp đi một món đồ quý giá giấu dưới gầm giường. Kẻ trộm sau đó giao cho tay giang hồ A Dìn nhưng gã đã bị thủ tiêu ngay để bịt đầu mối. Ở thời điểm hiện tại, Hiền là một võ sĩ giải nghệ do chấn thương. Anh phải đi làm thêm cả dạy võ lẫn giao hàng để mưu sinh. Một ngày, Hiền phát hiện vợ mình mắc bệnh tim cần một số tiền lớn để mổ gấp, anh tìm tới A Dìn để mượn tiền. Tay giang hồ giả vờ tốt bụng cho anh vay tiền và mời về làm người giao hàng. Sau khi Hiền giao một món hàng bí ẩn cho A Dìn, hắn lại muốn giết Hiền để diệt khẩu. Hiền chạy thoát cùng với món hàng, rồi đưa Nga và bé Mi - vợ và con gái anh - đi trốn. Thực ra trước đó Hiền đã giật món hàng từ tay ông trùm xã hội đen tên Khanh do mắc mưu của A Dìn. Ông Khanh ra lệnh cho A Dìn phải bắt Hiền về trị tội. Gia đình Hiền xuống Châu Đốc, ghé thăm hai người bạn là cặp vợ chồng Lâm và Thảo. A Dìn biết được vị trí của Hiền vì Thảo đăng một bức ảnh bữa cơm gia đình lên Facebook. Hiền yêu cầu A Dìn đi một mình đến gặp anh nhưng anh kịp thời phát hiện hắn dẫn theo bọn thuộc hạ. Bọn côn đồ bắt vợ chồng Lâm khai ra vị trí của Hiền. Sau đó chúng ập vào nhà nghỉ mà gia đình Hiền đang ở, ba người phải sử dụng rèm cửa để leo xuống đất và tiếp tục bỏ chạy. Gia đình Hiền được ông Tư xe lôi giúp chạy thoát, họ về nhà vợ chồng Lâm, tất cả mọi người phải lặn xuống bên dưới sàn bến khi bọn giang hồ kéo đến lục soát căn nhà. Họ đến nhà ông Tư nhờ giúp đỡ. Món hàng Hiền lấy được chính là bạch kỳ nam - một miếng gỗ quý trị giá hàng tỷ đồng, nó cũng là món đồ quý giá năm xưa bị lấy trộm khỏi nhà anh. Sáng hôm sau, bé Mi bị sốt, Hiền phải đánh lạc hướng bọn giang hồ để Nga đưa con gái vào bệnh viện. Hiền trốn thoát thành công nhờ hòa vào đám đông đang tham gia lễ hội. Bọn giang hồ đến bệnh viện thì bắt được Nga và bé Mi. A Dìn buộc Hiền giao nộp bạch kỳ nam để đổi lấy vợ con anh. Họ hẹn gặp nhau trên một chiếc phà, A Dìn cho thuộc hạ sử dụng dao ám sát Hiền nhưng Hiền đã chống trả thành công. Đúng lúc đó, trên phà cũng xảy ra một vụ tai nạn: một chiếc xe khách bị chìm xuống sông. Sau đó cuộc rượt đuổi bằng xuồng máy vỏ lãi diễn ra, ông Tư chở Hiền và Lâm đuổi theo bọn giang hồ. A Dìn tạo ra một vụ nổ hòng giết Hiền nhưng chàng võ sư vẫn thoát nạn. Lực lượng công an đã đến giúp đỡ sau khi nhận được tin báo của Lâm, họ chặn đường thoát của bọn giang hồ. Cuộc giao chiến dữ dội khiến Hiền bị thương nặng, Nga cũng lên cơn đau tim. Cuối cùng công an đã bắn hạ A Dìn và bắt giữ bọn thuộc hạ của hắn. Vợ chồng Hiền được cứu chữa. Ông Tư tiết lộ với công an rằng ông chính là kẻ trộm năm xưa lấy bạch kỳ nam trong nhà Hiền, ông vẫn còn sống sau khi bị A Dìn sát hại và lẩn trốn đến tận bây giờ. Trên Sài Gòn, ông Khanh cũng bị bắt vì tội buôn bán hàng quốc cấm. Hiền vẫn giữ lại bạch kỳ nam, tiếp tục xem nó là báu vật của gia đình. Hai gia đình của Hiền và Lâm trở lại với cuộc sống bình yên, cuối phim họ ghé thăm cặp vợ chồng già neo đơn.",6,3
31,Doraemon: Nobita và bản giao hưởng Địa Cầu,Imai Kazuaki,148[26],2024,"Lớp học chuẩn bị cho tiết mục hòa tấu sáo recoder trong buổi hòa nhạc của trường, Nobita thổi sáo tệ đến mức gây cười cho cả lớp. Chỉ vì nốt ""No"" lạc quẻ mà Jaian và Suneo còn không buông tha, thậm chí còn chọc cậu ngay cả trên đường về nhà. Về đến nhà, Nobita nhìn thấy Doraemon đã dùng cuốn Nhật kí định sẵn để ăn tháp bánh Dorayaki, nên cậu tận dụng điều đó cùng nỗi sợ chuột cuả Mèo Ú để đánh tráo báo bối đó. Có cuốn nhật kí trong tay, cậu ghi vào đó ""Hôm nay không có âm nhạc. Thật là vui... để tránh tiết học âm nhạc. Hôm sau, cả thế giới bỗng nhiên náo động vì không còn âm nhạc nữa. Doraemon nhận ra cuốn sổ bị đánh tráo, nên tìm đến Nobita lấy lại cuốn nhật ký định sẵn từ cặp sách. Nhận ra hậu quả từ việc loại bỏ âm nhạc, cả hai liền xé bỏ trang nhật kí mà Nobita đã chép rồi mọi thứ trở về như bình thường. Trong khi đó, tại Viện Khoa học Vũ trụ, một bào tử lạ chui ra từ mẫu đất lấy được ở tiểu hành tinh Urashima đã lợi dụng sự hỗn loạn mà trốn khỏi phòng nghiên cứu. Buổi chiều, Nobita vừa đi trên bờ đê vừa tập thổi sáo nhưng đều bị cười vì nốt nhạc kỳ dị mà cậu thổi ra, nên cậu chạy xuống bãi cỏ ở gần bờ sông mà bỏ cuộc. Đúng lúc đó, một cô bé kỳ lạ đứng nhìn chầm chằm vào cậu và yêu cầu cậu chơi một đoạn nhạc rồi tự mình cất giọng một bài hát kỳ lạ. Nobita dẩn cảm thấy nhẹ nhõm vì giọng hát này, nhưng khi cậu quay lại thì cô bé đó đã biến mất. Hôm sau, nhóm Nobita ra ngoài bờ sông luyện tập cho buổi hòa nhạc, Jaian và Suneo cực kỳ khó chịu mỗi khi Nobita thổi ra nốt ""No"" đến mức cậu dùng dằn muốn bỏ về. Bỗng chợt họ nghe giọng hát vang lên từ cô bé kỳ lạ mà Nobita đã gặp hôm trước. Cô bé cũng yêu cầu nhóm bạn chơi đoạn nhạc rồi cùng hát trên đoạn nhạc đó. Doraemon cũng góp vui với những món đồ chơi của họ được gắn Hạt robot để tấu nhạc cùng Ban nhạc cảm xúc thăng hoa đã tạo nên tiết mục ngẫu hứng ở bãi đất này, nhưng sau đó cô bé đó lại biến mất. Chiều tối, Nobita và Doraemon nhận được tấm thiệp hẹn gặp tại phòng nhạc của trường tối nay, Nobita nhận ra con dấu trên tấm thiệp ứng với họa tiết trên áo của cô bé nọ. Nửa đêm cả nhóm Doraemon đều đến phòng nhạc ở trường cùng từ tấm thiệp mời đó. Shizuka nhìn thấy giấy ghi chú trên cây đàn piano và chơi một đoạn bài Für Elise của Beethoven như yêu cầu trên tờ giấy. Sau đó phòng chuẩn bị phát sáng kèm theo lời yêu cầu khẩn thiết và giọng hát quen thuộc, cả nhóm bạn vào trong phòng và lập tức được phóng ra ngoài vũ trụ và tiến vào một khoang tàu kỳ lạ rồi dẫn vào trong một không gian tối với kết cấu trong suốt. Cả nhóm mò mẫm xong quanh và nhận ra những kết cấu ấy phát sáng và phát ra âm thanh khi được tiếp xúc và rồi mọi người cùng tạo nên âm điệu từ kết cấu đó. Âm thanh do nhóm Nobita tạo ra ra tích tụ lại rồi phát sáng cả một vùng không gian, nắp vòm mở ra và họ thấy cô bé kỳ lạ đó là người hành tinh Museaca, Micca cùng chú robot Chapeck đang chờ sẵn. Micca cho biết cả nhóm đang ở cung điện Farre (từ mà người Museaca chỉ âm nhạc), Chapeck nhận ra nhóm Nobita là năm virtuoso - bậc thầy âm nhạc huyền thoại mà cậu đang mong chờ. Mọi người vào phòng Micca và vào kho trong phòng chứa nhạc cụ mà Chapeck sưu tầm. Nhờ bảo bối Sợi chỉ đỏ tơ hồng, Jaian, Suneo, Shizuka và Nobita lần lượt chọn được kèn Tuba, violin, trống Bongo và sáo recoder, cùng với Chứng chỉ chuyên viên âm nhạc giúp họ chơi được nhạc cụ mà mình đã chọn. Khi mọi việc đã xong, Chapeck nhấn nút vào đường ống dẫn đến loa lớn phóng ra những nơi khác trên cung điện Farre. Đầu tiên, cả nhóm hạ cánh xuống nhà của Mortzel và Bachi, nhóm bạn trừ Nobita chơi đoạn nhạc để kích họat nước chảy bằng năng lượng Farre đó. Jaian, Suneo và Shizuke đều được thăng cấp chứng chỉ sau đó. Dòng nước chảy đến khu rừng ở gần đó, mọi người theo theo dòng chảy để vào đó. Nhóm bạn vào khu rừng âm u gặp được Takiren đang u buồn khiến thời tiết ở đó u ám. Mọi người phải chơi bản nhạc mà Chapeck biên soạn nhưng lại gây ra mưa nặng hạt, Chapeck sửa lại bản nhạc để họ chơi lại và trời liền tạnh mưa, họ được thăng cấp ngay sau đó. Takiren là robot coi sóc nơi an nghỉ của người Museaca từng sống trong cung điện Farre vốn là tàu cứu sinh của họ đã rời khỏi hành tinh mẹ sau đại họa ở đó, ông còn tiết lộ Micca là đứa trẻ Museaca duy nhất còn sống. Sau đó, nhóm bạn đi đến những khu phố trong cung điện, cùng hòa chung giai điệu với cư dân là những robot nhạc công để tạo nên buổi trình diễn đánh thức cả khu phố. Jaian và Suneo tách ra khỏi nhóm mà đi, cả hai nghe tiếng ồn ào khó chịu phát ra từ nhà máy Farre. Cả hai tiến vào bên trong nhà máy đang được Wakner sửa chữa, rồi cả ba phát hiện bào tử Noise đã xâm chiếm nơi này. Wakner yêu cầu Jaian và Suneo dùng âm nhạc diệt trừ đám Noise nhưng không làm được nên ông đẩy cả hai vào đường ống để tự mình xử lý. Cả hai theo đường ống phóng về nhà của Mortzel và Bachi nơi mọi người đang tìm. Khi tập họp đông đủ, cả nhóm trở về Trái Đất. Ban ngày, trong khi Doraemon và nhóm Nobita chống chọi cơn buồn ngủ do thức nguyên đêm trong buổi học cuối cùng trước khi nghỉ hè, Micca và Chapeck khám phá âm nhạc ở Trái Đất. Chiều tối, Nobita phải làm hết bài tập hè trong khi Micca và Chapeck hò reo khích lệ, xong cậu tiện tay mở cuốn Nhật ký định sẵn viết Hôm nay mọi người cùng nhau đi tắm, thật là vui. khi bất chợt nghe bà Nobi nhắc nhở việc này. Nửa đêm, cậu đi xuống nhà tắm để tập thổi sáo cho tiết mục của lớp học. Sáng hôm sau, cả nhóm tập trung tại bãi đất trống, dùng cánh cửa thần kỳ để trở lại Cung điện Farre và đến thẳng thần điện Maestro. Nobita chợt nhớ mình để quên cây sáo ở nhà, Doraemon đành dùng Máy thay đổi thời - không quay về nhà Nobi vào đêm hôm trước để lấy cây sáo. Khi mọi người bước vào thần điện, Chapeck phát hiện giáo sư Bentho đã bất động từ lâu do đã dùng cả năng lượng của chính mình để chơi nhạc mà duy trì hoạt động của cung điện cho đến khi cạn kiệt, Doraemon phải sửa chữa Bentho. Khi hồi tỉnh lại, Bentho kể lại cho nhóm bạn hành tinh Museaca vốn tràn đầy Farre từ ca hát và chơi nhạc. Đến một ngày người dân bị cấm biểu diễn bởi những kẻ có ý đồ độc quyền Farre dẫn đến hành tinh không còn tiếng nhạc, Noise từ ngoài vũ trụ kéo đến xâm chiếm Museaca khiến cư dân phải rời bỏ hành tinh mẹ. Ông cũng chỉ cho họ biết Noise sẽ lợi dụng thời điểm không có âm nhạc để tấn công, điều đó khiến cho Doraemon và Nobita hoảng hốt vì nội dung trong trang nhật ký bị xé khiến cho Noise len lỏi xuống Trái Đất, và chỉ có Farre từ âm nhạc mới khắc chế được nó. Đồng thời Bentho chỉ cho nhóm bạn chìa khóa để hồi sinh cung điện mà chỉ có thể mở được bằng cây sáo Museaca, và tiết lộ người em gái song sinh của Micca đã được gửi xuống Trái Đất cùng cây sáo Museaca từ 4 vạn năm trước, còn cô được cho ngủ đông từ đó cho đến khi thức dậy. Nhóm bạn liền đi đến bảo tàng Uneo và tìm thấy mẫu vật cây sáo bằng xương thiên nga mà cô Hattori đã nhắc đến trong giờ âm nhạc. Doraemon nhỏ Nước hoa kỉ niệm nhỏ vào cây sáo, hình ảnh dần xuất hiện: 4 vạn năm trước, khoang thuyền chứa em gái song sinh của Micca rơi xuống gần bộ lạc của người Cro-Magnon ở khu vực thuộc Đức hiện nay. Cô bé được cư dân cưu mang cho đến khi trưởng thành và đem âm nhạc vào Trái Đất từ đó. Cây sáo bằng xương thiên nga được làm dựa theo cây sáo Museaca. Suneo nhận ra giọng ca, thần thái và giai điệu rất giống với danh ca người Đức Mina, hậu duệ của em song sinh Micca, hiện đang lưu diễn tại Nhật Bản. Micca tìm đến nơi đang tổ chức lưu diễn của Mina rồi tìm đến cô để mượn cây sáo Museaca vốn là bảo vật của gia đình mà cô đang giữ. Mina nhận ra màu tóc của Micca giống của mình nên gửi cây sáo đó cho cô. Nhóm bạn hốt hoảng vì Doraemon bất tỉnh do bị bào tử Noise xâm nhập trước đó, nên đem cậu ra bãi đất trống để dùng cây sáo Museaca loại trừ bào tử Noise nhưng Micca phát hiện cây sáo đã bị vỡ mất nốt cuối cùng từ trước. Nhóm Nobita chơi bản nhạc trong buổi hòa tấu nhưng các âm điệu xung đột với nhau, Chapeck còn đang chỉnh lại bản nhạc thì họ đã chơi lại bản hòa tấu đó hài hòa hơn và tống khứ Noise ra khỏi họng của Doraemon. Nhóm bạn nhanh chóng trở lại thần điện Maestro, Nobita và Micca vào trong thần điện mở khóa, trong khi số còn lại cùng những robot khác chống chọi đám Noise. Micca dùng cây sáo Museaca để mở khóa nhưng chìa khóa chưa mở hoàn toàn do thiếu một nốt bị vỡ của cây sáo. Noise chui vào bên trong tấn công Nobita và Micca, Nobita hốt hoảng thổi cây sáo của mình để chống trả lại mà vô tình thổi ra nốt ""No"" là nốt bị khuyết của sáo Museaca. Chìa khóa được mở, ngọn tháp hình cây sáo mọc lên từ nóc thân điện có thể phát Farre vang vọng ngoài không gian. Bào tử Noise bị tiêu diệt hoàn toàn khỏi cung điện Farre nhờ nguồn năng lượng đó. Bentho cho tập hợp toàn bộ robot trong cung điện cùng nhạc cụ của mình đến quảng trường chính trước thần điện, trong khi Noise đang dần tiến về Trái Đất và cùng điện. Tất cả mọi người cùng nhóm Doraemon hòa tấu Bản giao hưởng Địa Cầu do Chapeck sáng tác. Farre từ bản hòa tấu phát ra ngăn chặn được Noise lúc đầu, nhưng nó dùng chính vòi của mình bẻ gãy ngọn tháp của thần điện, hất tung Micca và nhóm Doraemon ra ngoài không gian Vũ Trụ tĩnh lặng. Khi Nobita đang hoảng sợ trước sự im lặng, các món bảo bổi của Doraemon va chạm nhau rồi dụng vào núm điều khiển của Máy thay đổi thời - không. Từ Vũ trụ phát ra giai điệu từ nhóm bạn, những món đồ chơi của họ cùng giọng hát của Micca làm thêm một tiết mục biểu diễn ngoài không gian. Sau cùng, nhóm Doraemon, các robot trong cung điện cùng biểu diễn và hòa chung những âm thanh giai điệu từ Trái Đất làm thành chương kết của Bản giao hưởng Địa Cầu tạo nên nguồn Farre cực mạnh dưới hình chú thiên nga nuốt chửng Noise và làm tan biến nó ngay lập tức. Doraemon cầm lấy Máy thay đổi thời - không vừa va và mình liền hốt hoảng vì cả Trái Đất lẫn cung điện và tất cả mọi người đều được dịch chuyển vào nhà tắm của nhà Nobi đúng như nội dung trong Nhật ký định sẵn mà Nobita đã ghi, là lý do mà âm thanh vang vọng được ngoài Vũ Trụ. Trong căn phòng của mình, Micca vẫn còn lưu giữ món đồ chơi của nhóm Nobita, Chapeck thông báo cho cô là cung điện Farre đã kết nối liên lạc với những tàu cứu sinh khác của cư dân Museaca nhờ buổi trình diễn vừa rồi. Ngày hội diễn văn nghệ vừa đến, tiết mục của lớp Nobita vang lân rộn ràng trong phòng âm nhạc, bổng Nobita bất chợt lại thổi lên nốt ""No"" kì dị đó.",3,3
32,Fast & Furious 7,James Wan,146,2015,"Trong Fast & Furious 7, tên sát thủ Deckard Shaw (Jason Statham) muốn báo thù cho em trai Owen Shaw (Luke Evans) - nhân vật phản diện ở phần 6. Gã sát hại Han, khiến đặc vụ Luke Hobbs (Dwayne ""The Rock"" Johnson) phải nhập viện, còn gia đình của Dominic Torretto, Mia, Brian O'Conner và bé Jack suýt mất mạng. Lúc này, một lực lượng ngầm của chính phủ cũng muốn tóm tên Deckard Shaw, nhưng mục tiêu cao hơn của họ là Nhãn Thần - thứ thiết bị giúp người dùng có thể định vị đối tượng trong thời gian ngắn nhất. Nhân viên cao cấp mang biệt danh ""Mr. Nobody"" (Kurt Russell) muốn Dom và nhóm của anh giải cứu và tìm ra thông tin về thiết bị từ một hacker có tên Ramsey - người đang bị một tổ chức khủng bố bắt cóc. Đổi lại, ""Mr. Nobody"" sau đó sẽ cho phép Dom sử dụng nó để tìm ra Shaw anh.",6,3
33,Godzilla x Kong: Đế chế mới,Adam Wingard,141[27],2024,"Kong và Godzilla – hai sinh vật vĩ đại huyền thoại, hai kẻ thủ truyền kiếp sẽ cùng bắt tay thực thi một sứ mệnh chung mang tính sống còn để bảo vệ nhân loại, và trận chiến gắn kết chúng với loài người mãi mãi sẽ bắt đầu.",0,0
34,Đất rừng phương Nam,Nguyễn Quang Dũng,140[28],2023,"An là một cậu bé sinh sống ở đô thành của khu vực Nam Kỳ Lục tỉnh cùng với mẹ của mình vào những năm 1920 – 1930. Cha của An là Hai Thành, một người đi theo cách mạng với mong muốn đánh đuổi thực dân Pháp ra khỏi Việt Nam. Khi danh tính của Hai Thành bị bại lộ, mẹ của An đã dẫn cậu rời khỏi đô thành dưới sự chỉ dẫn của thầy giáo Bảy. Trên đường đi, một cuộc biểu tình của quần chúng nhân dân đã bất ngờ diễn ra khi Võ Tòng – một thành viên của tổ chức Nghĩa quân Lục tỉnh – bị bắt giữ. Tại đây, một vụ xô xát đã diễn ra giữa binh lính Pháp và những người biểu tình, dẫn đến việc mẹ của An vô tình đã bị lính Pháp bắn chết. Út Lục Lâm – một tên trộm trong thời chiến khi đang lang thang trên đường đã vô tình thấy cảnh tượng này, nên anh đã quyết định hỗ trợ An rời khỏi đó. Sau khi chôn cất mẹ của mình, An đã bị ngất vì đói nhưng được Út Lục Lâm cưu mang bằng số tiền mà anh trộm được. Để sinh tồn, An cũng đã phải học cách ăn trộm theo Út Lục Lâm. Trong một dịp Tết Đoan ngọ, chính quyền bảo hộ Pháp dưới sự chỉ đạo của tướng Durie đã quyết định xử tử Võ Tòng công khai trước mặt quần chúng nhân dân nhằm răn đe về hành vi phản loạn, chống lại chính quyền bảo hộ. Trong lúc chứng kiến vụ hành quyết, An đã bị say men cơm rượu và cậu vô tình trở thành người khai màn cho việc cướp pháp trường và giải cứu Võ Tòng, với sự xuất hiện phản công ngay sau đó của tổ chức Chính Nghĩa hội[a] – một chi nhánh trong tổ chức Nghĩa quân Lục tỉnh. Sau khi Võ Tòng được giải cứu, An và Út Lục Lâm cũng bắt đầu mất liên lạc với nhau. An được cưu mang bởi ông Tiều – một thầy thuốc người Hoa và cũng là một thành viên của Chính Nghĩa hội, bên cạnh đó ông có một đứa con gái tên là Xinh. An đã được ông Tiều huấn luyện và trở thành một thành viên của Chính Nghĩa hội sau lời thề. Trong một buổi ghé thăm chợ nổi trên sông, An có dịp gặp gỡ với Cò, ông Ba ""bắt rắn"", bác Ba Phi, bà Tư Ù và Tư Mắm – một tiểu thư đang theo đuổi ông Tiều. Một gánh hát cải lương với sự góp mặt của thầy giáo Bảy cũng đã đến khu vực nhằm lan tỏa nghệ thuật về lòng yêu nước cho nhân dân. Cả ba bạn An, Cò và Xinh cũng được mời tham gia diễn tuồng trong dịp Tết Trung thu sắp diễn ra. Không lâu sau đó, một thành viên của Chính Nghĩa hội bị bắt giữ. Nhiều nghĩa quân của khu vực Nam Kỳ cùng lực lượng cách mạng đã có một cuộc trao đổi nhằm giải thoát các tù nhân, nhưng giữa họ lại nảy sinh nhiều mâu thuẫn. Trong lúc thi hành giải thoát tù nhân, ông Tiều không may đã bị bọn lính Pháp bắt giữ rồi nhốt vào trong tù, nơi ông bàng hoàng khi phát hiện ra Tư Mắm – người đang có mối quan hệ tình cảm với tướng Durie – thực chất là một gián điệp được cài vào làng quê nhằm tìm diệt các tổ chức nghĩa quân cũng như lực lượng cách mạng. Cùng lúc đó, Út Lục Lâm đang lẻn vào dinh thự của tướng Durie để trộm thì phát hiện sự việc trên, nên anh liền báo tin cho An. Khi bị bắt giữ, Xinh đã ngây thơ vô tình tiết lộ cho Tư Mắm biết về thân phận cha của An và cả hai sẽ gặp nhau trong dịp Tết Trung thu ở gánh hát cải lương. Vào dịp Tết Trung thu, gánh hát cải lương đã được diễn ra với sự quản lý chặt chẽ của binh lính Pháp. Trong lúc vở cải lương được diễn, An vào vai một vị vua và phát hiện ra rằng người đang vào vai ngai vàng mình đang ngồi chính là cha của mình, nên cậu đã quỳ xuống và cảm tạ vì quá xúc động. Lúc này, Tư Mắm đang ngồi ở phía ghế khán đài đã ra hiệu cho tướng Durie đổ quân vào gánh hát, trong khi vở cải lương vẫn tiếp tục diễn và rồi được che màn lại để giúp cho cha của An vào bên trong cánh gà. Tướng Durie đã yêu cầu gánh hát ngừng diễn và bắt đoàn phải giao nộp Hai Thành ra, nhưng đã bị thầy giáo Bảy từ chối. Sau đó, thầy giáo Bảy đã bị tướng Durie bắn chết tại chỗ, còn bác Ba Phi cũng nhanh chóng kêu gọi quần chúng nhân dân chống lại quân Pháp nhưng rồi bị Tư Mắm bắn chết. Trước việc lo sợ nhiều dân thường phải hy sinh, Hai Thành đã quyết định lộ diện nhưng được lực lượng cách mạng cùng các nghĩa quân giải vây. Do biết được thân phận của An, Tư Mắm quyết định đuổi theo cậu khi cậu đang cùng ông Tiều, Cò và Xinh bỏ chạy. Trong lúc nguy cấp, Út Lục Lâm đã bất ngờ xuất hiện và nhanh chóng đỡ đạn khi Tư Mắm định giết An, may thay anh vẫn còn sống sót vì viên đạn chỉ trúng vào bảo vật của mẹ An trong túi áo của anh. Ông Tiều đã phi đao giết chết Tư Mắm ngay sau đó. Sau khi trốn thoát thành công, An và những người thân cận của mình cùng đi phiêu du trên sông, và rồi họ gặp Út Trong khi cô đã cất lên câu hò của vùng đất Nam Bộ. Trong lúc này, một con cá sấu đã xuất hiện tấn công cả bọn khi đang đi trên ghe thì họ được Võ Tòng giải cứu. Việc Võ Tòng xuất hiện như đang báo hiệu với An rằng cha của cậu đã trốn thoát thành công trong cuộc bao vây đột xuất của binh lính Pháp. Hành trình của An và những người thân cận khác chắc chắn vẫn còn nhiều chông gai ở phía trước.",6,0
