Thứ hạng,Tên Phim,Đạo diễn,Doanh Thu,Năm,Nội dung,Nhóm,cluster
16,Avengers: Cuộc chiến vô cực,Anthony RussoJoe Russo,189,2018,"Sau khi lấy được Viên đá Sức mạnh, một trong sáu Viên đá Vô cực từ hành tinh Xandar, Thanos cùng các con nuôi - Ebony Maw, Cull Obsidian, Proxima Midnight và Corvus Glaive - tấn công tàu Statesman đang chở theo những cư dân tị nạn Asgard, sát hại một nửa số người ở đây. Thanos tra tấn Thor nhằm buộc Loki giao nộp Viên đá Không gian ẩn chứa trong khối Tesseract. Hulk cố gắng ngăn cản nhưng cũng bị Thanos đánh bại chóng vánh. Heimdall trong lúc thoi thóp đã kịp sử dụng sức mạnh của cầu Bifröst để đưa Hulk trở về Trái Đất, rồi ông bị Thanos phát hiện và đâm chết,. Loki giả vờ đầu hàng hòng giết Thanos, để rồi chịu chung kết cục với Heimdall. Thanos sau đó phá hủy con tàu để Thor trôi dạt ngoài vũ trụ. Hulk rơi xuống Thánh đường Sanctum Sanctorum ở Thành phố New York và biến trở lại thành Bruce Banner. Anh cảnh báo Doctor Strange và Wong về kế hoạch tiêu diệt sự sống một nửa vũ trụ của Thanos, và họ gọi Tony Stark đến trợ giúp. Ngay sau đó, Ebony Maw và Cull Obsidian dùng tàu không gian tấn công New York nhằm trấn lột Viên đá Thời gian của Strange. Spider-man, tức Peter Parker cũng xuất hiện và tham chiến bảo vệ New York (mặc dù công việc đòi hỏi Spider-man phải ở lại New York), nhưng Hulk không chịu ra mặt dù Banner cố năn nỉ. Do không lấy được Viên đá Thời gian, Maw bắt Strange lên tàu của hắn. Tony và Peter lần theo dấu Strange lên tàu Maw. Nghĩ rằng Thor đã chết, Banner cố liên lạc với Steve Rogers tìm sự trợ giúp, còn Wong ở lại để tiếp quản bảo vệ Thánh đường. Tại Edinburgh, Vision và Wanda Maximoff bị Corvus Glaive và Proxima Midnight phục kích để lấy cắp Viên đá Tâm trí trên trán Vision. Vision bị đâm xuyên người khiến anh gần như mất khả năng chiến đấu, hoàn cảnh ngặt nghèo dồn Wanda vào đường cùng. Trước khi Wanda dùng đòn phép quyết tử với bọn họ, thì nhóm Steve Rogers, Natasha Romanoff và Sam Wilson bất ngờ xuất hiện đánh bị thương Corvus và Proxima. Nhưng 2 tên này lại chạy thoát. Steve đưa vợ chồng Vision & Wanda quay về căn cứ của đội Avengers, hội ngộ James Rhodes và Banner. Romanoff cho biết hiện tại không thể liên lạc với Clint Barton và Scott Lang vì họ đang chịu án quản thúc tại gia. Rogers gợi ý mọi người đưa Vision đến vương quốc Wakanda để nhờ trợ giúp tháo Viên đá Tâm trí ra khỏi trán anh mà không làm tổn hại đến anh. Nhóm Vệ binh dải Ngân Hà tìm thấy Thor khi họ bắt được tín hiệu khẩn cấp từ tàu Statesman. Thor đoán Thanos sẽ tìm đến Viên đá Hiện thực nằm trong tay Collector ở Knowhere. Vì vậy, đội vệ binh chia ra hai nhóm: Biết Gamora nói dối mình không tìm thấy Viên đá Linh hồn, Thanos doạ giết Nebula, người đã bị bắt sau khi mưu sát hắn không thành. Gamora đành phải khai ra vị trí của viên đá là hành tinh Vormir và dẫn đường cho hắn đến nơi. Tại đây, họ gặp thủ hộ của Viên đá Linh hồn là Red Skull và biết được rằng ai muốn có viên đá phải mất đi người mà mình thật lòng yêu thương. Thanos đành ném Gamora xuống vực sâu để có được viên đá. Nebula sau khi trốn thoát đã gửi một tín hiệu cho Mantis rằng cô sẽ gặp nhóm Vệ binh dải Ngân Hà ở Titan, hành tinh chết đã từng là quê hương của Thanos. Sau khi giết Maw, nhóm Tony, Peter và Strange thảo luận tránh khỏi Trái Đất, đến Titan và gặp Peter Quill, Drax và Mantis, và họ cùng nhau bàn kế hoạch tháo Găng tay Vô cực ra khỏi tay Thanos. Strange dùng Viên đá Thời gian để xem trước mười bốn triệu sáu trăm linh năm (14.000.605) tương lai khả thi của cuộc chiến với Thanos, nhưng chỉ thấy có 1 kết quả chiến thắng. Sau khi lấy được Viên đá Linh hồn, Thanos trở về Titan đến tận nơi Strange đang giữ đá thời gian, tiết lộ động cơ là để ""cứu"" vũ trụ khỏi nguy cơ bị diệt vong vì sự bùng nổ dân số như đã xảy ra làm diệt vong Titan. Ngay sau đó, các siêu anh hùng phục kích và khống chế thành công Thanos, dù rất chật vật. Tony và Parker gần tháo được Găng tay Vô cực ra khỏi tay Thanos đang bị Mantis thôi miên, nhưng Quill sau khi biết Gamora đã chết liền tức giận đấm liên tiếp vào mặt Thanos, vô tình làm hắn bừng tình. Thanos dễ dàng đánh bại cả đội và đâm Stark trọng thương. Strange đầu hàng, giao nộp Viên đá Thời gian cho Thanos đổi mạng Tony. Thanos theo giao kèo nhận được đá, hắn teleport đến Wakanda vì đá tâm trí đang ở đó. Bằng năng lực triệu hồi cầu Bifrost của rìu Stormbreaker, Thor tuần tra Cửu Giới và phát hiện bọn tuỳ tùng của Thanos đang gây chiến ở Wakanda. Đội Avengers cùng người dân ở vương quốc hợp sức chiến đấu để phòng thủ. Khi bất lợi nghiêng dần về phía các anh hùng, nhóm Thor, Rocket và Groot xuất hiện chi viện kịp thời. Nhưng nhân lúc Wanda bị nhử ra tiền tuyến, Corvus Glaive phục kích phòng thí nghiệm của Shuri, khiến Vision lại bị đẩy vào chiến trường. 3 đứa con nuôi của Thanos gồm Midnight, Obsidian và Glaive lần lượt tử trận, song Thanos xuất hiện sau đó và đánh bại lần lượt các thành viên đội Avengers đang trong vô vọng. Wanda phá hủy Viên đá Tâm trí khiến Vision bị tan xác theo, nhưng Thanos đã sử dụng Viên đá Thời gian để đảo ngược sự việc đó rồi tháo Viên đá Tâm trí còn nguyên vẹn, giết chết Vision lần thứ hai và thu thập đủ sáu Viên đá Vô cực. Sau đó, Thor bất ngờ tấn công ném rìu Stormbreaker trúng ngay ngực Thanos. Thor đang tra tấn Thanos để trả thù cho bạn anh (Heimdall), nhưng hắn vẫn còn thoi thóp và cà khịa Thor vì không nhắm vào đầu hắn. Thanos búng ngón tay, kích hoạt sức mạnh của cả sáu viên đá rồi teleport bỏ trốn, mặc dù sức mạnh của các viên đá cùng được kích hoạt khiến cả chiếc găng tay lẫn nửa cơ thể bên trái hắn bị tổn thương nặng. Sự sống của một nửa số sinh vật trong vũ trụ lần lượt bị tiêu diệt. James ""Bucky"" Barnes, một nửa dân số Wakanda, T'Challa, Groot, Wanda, Wilson, Mantis, Drax, Quill, Strange và Parker lần lượt hoá thành tro bụi. Tony và Nebula còn sống sót nhưng kẹt lại trên Titan, trong khi ở Wakanda chỉ còn lại Bruce Banner, M'Baku, Okoye, Rhodes, Rocket, Steve, Natasha, Thor và một nửa lực lượng còn sống. Về phần mình, sau khi búng tay, Thanos thấy mình tạm thời được dịch chuyển vào không gian của Viên đá Linh hồn và gặp lại Gamora lúc nhỏ. Hắn nói với cô bé rằng mình đã làm được, nhưng với cái giá là ""mọi thứ"". Rồi hắn đến một hành tinh yên bình, ngồi sửa chữa lại các vết thương trên người. Trong phần cảnh hậu danh đề, hàng loạt vụ tai nạn xe hơi và máy bay xảy ra do người lái tan biến. Nick Fury và Đặc vụ Maria Hill cũng trở thành nạn nhân, nhưng Fury trước khi tan biến đã kịp gửi một tín hiệu khẩn cấp cho Carol Danvers / Captain Marvel.",5,5
17,Bỗng dưng trúng số,Park Gyu-Tae,182[17],2022,"Tác phẩm lấy bối cảnh là khu biên giới quân sự giữa Hàn Quốc - Triều Tiên. Người lính Hàn Chun Woo (Go Kyung-Pyo) vô tình nhặt được vé số trúng độc đắc trị giá 5,7 tỷ Won (tức 105 tỷ VND). Anh chàng bất cẩn để tờ vé số bay sang bên kia biên giới, rơi vào tay người lính Triều Tiên Yong Ho (Lee Yi-Kyung). Chun Woo muốn đòi lại, còn Yong Ho không trả nhưng không thể sang Hàn Quốc lĩnh thưởng. Câu chuyện càng rắc rối khi đồng đội của cả hai biết được và tham gia vào cuộc đàm phán. Thỏa thuận được đưa ra là phe Triều Tiên trả lại vé số, phía Hàn Quốc nhận nhiệm vụ đổi thưởng. Trước khi tiền được mang về, hai bên trao đổi một người lính để làm tin, người được chọn là Chun Woo và Yong Ho. Màn hoán đổi kéo theo nhiều chuyện dở khóc dở cười, khi hai người lính cố gắng tránh lộ thân phận trong môi trường quân ngũ mới.",1,1
18,Mắt biếc,Victor Vũ,180[18],2019,"Mắt biếc xoay quanh mối tình đơn phương của Ngạn với Hà Lan, cô bạn gái có cặp mắt hút hồn nhưng cá tính bướng bỉnh. Một chuyện tình nhiều cung bậc, từ ngộ nghĩnh trẻ con, rồi tình yêu thuở học trò trong sáng, trải qua bao biến cố, trở thành một cuộc ""đuổi hình bắt bóng"" buồn da diết nhưng không nguôi hi vọng. Câu chuyện càng trở nên éo le hơn khi Trà Long - con gái của Hà Lan lớn lên lại nhen nhóm một tình yêu như thế với Ngạn. Phim lấy bối cảnh ở thập niên 1960 và 1970. Nhân vật chính là Ngạn, cậu bé sinh ra và lớn lên tại ngôi làng Đo Đo, tỉnh Quảng Nam (cũng là nguyên quán của tác giả Nguyễn Nhật Ánh). Cậu yêu mến cô bạn tên Hà Lan, người có đôi mắt đẹp tuyệt trần mà Ngạn tự gọi là ""mắt biếc"". Cả hai cùng trải qua biết bao nhiêu kỷ niệm tại làng quê nghèo này, dần dần trong Ngạn nảy sinh một tình yêu thầm lặng dành cho Hà Lan. Khi lớn lên, cả hai đều đi học trên thành phố Huế. Hà Lan ở chung nhà với người cô trong khi Ngạn ở chung nhà với cậu Huấn. Cậu Huấn có một người con trai tên Dũng, là anh họ của Ngạn. Tuy là con nhà giàu, sành điệu và giỏi võ, nhưng Dũng không phải là người đàng hoàng. Một lần Hà Lan qua tìm Ngạn để mượn sách, Dũng đã để ý Hà Lan và từ đó tìm cách tán tỉnh cô, điều này làm Ngạn thấy khó chịu. Không thể cưỡng lại sức hấp dẫn của chốn thành thị xa hoa nên Hà Lan đã ngã vào vòng tay Dũng. Mỗi khi Dũng làm Hà Lan đau khổ, Hà Lan tìm đến tâm sự với Ngạn. Hà Lan như vậy càng khiến Ngạn đau lòng hơn vì điều anh cần chỉ là thấy cô được hạnh phúc. Có lần Ngạn xảy ra ẩu đả với Dũng để rồi bị đánh tơi tả. Hà Lan mang thai nên phải nghỉ học và dọn đến khu phố khác. Ngạn biết chuyện nên thường đến chăm sóc cô. Trong khi Ngạn luôn bên cạnh chăm sóc Hà Lan thì Dũng đã cưới một cô gái khác tên Bích Hoàng. Hà Lan sinh ra một đứa con gái, đặt tên là Trà Long và gửi về quê cho bà ngoại nuôi. Cuối cùng Ngạn cũng tốt nghiệp, anh trở thành thầy giáo và trở về làng Đo Đo dạy học. Còn Hà Lan mở một tiệm may trên thành phố, cô luôn bận rộn với công việc, hiếm khi có thời gian về thăm. Một cô gái tên Hồng đem lòng yêu Ngạn từ thời đi học, cô cũng về làng Đo Đo dạy học để được ở gần bên anh, tuy nhiên Ngạn chỉ một lòng yêu Hà Lan. Ngạn đã chăm lo cho Trà Long suốt mười mấy năm, từ lúc cô bé còn nhỏ cho đến khi trở thành thiếu nữ đi học trên thành phố Huế. Trà Long như một bản sao của Hà Lan, làm Ngạn cảm thấy như được sống lại một thời ký ức ngày xưa. Biết rằng Ngạn sẽ không bao giờ yêu mình, Hồng đau khổ dọn vào Sài Gòn sống. Trà Long bắt đầu yêu Ngạn, điều này làm anh bất ngờ. Để tránh mọi chuyện tồi tệ hơn, Ngạn quyết định bỏ đi thật xa. Hai mẹ con Hà Lan đều sốc khi biết Ngạn ra đi. Sau một hồi tâm sự với Trà Long, Hà Lan hiểu rằng cô không nên bỏ lỡ một người yêu mình thật lòng. Hà Lan chạy ra nhà ga để giữ Ngạn lại, nhưng cô không đuổi kịp chiếc xe lửa. Hà Lan đã khóc, và ở trên xe lửa, Ngạn cũng khóc.",3,3
19,Thám tử lừng danh Conan: Dư ảnh của độc nhãn,Katsuya Shigehara,175[19],2025,"Tỉnh Nagano, dãy núi Yatsugatake, núi Mitakara. Khi Yamato Kansuke của Sở cảnh sát tỉnh Nagano đuổi theo một ""người đàn ông nào đó"" vào dãy núi tuyết, một vật thể lạ bất ngờ xuất hiện trong tầm nhìn của anh ta. Lợi dụng sự mất tập trung đó, ""người đàn ông nào đó"" mà anh ta đang đuổi theo đã bắn một viên đạn súng trường làm xước mắt trái của anh ta cùng lúc một trận tuyết lở xảy ra, đang gầm rú khắp khu vực. Trận tuyết lở đã nuốt trọn anh ta...

10 tháng sau. Một thành viên của đội ngũ nhân viên tại cơ sở nghiên cứu của Đài quan sát quốc gia Nobeyama bị ai đó tấn công. Sau khi nghe tin, Yamato Kansuke, người đã may mắn sống sót sau trận tuyết lở và Uehara Yui đã đến hiện trường. Trong lúc họ thẩm vấn đội ngũ nhân viên, ăng-ten parabol khổng lồ của cơ sở này đã hoạt động, và mắt trái của Yamato, vốn đã chết do tai nạn, đột nhiên bắt đầu đau dữ dội...

Vào đêm cùng ngày, một đồng nghiệp của Kogorō từ thời còn làm cảnh sát, có biệt danh là ""Wani"", gọi anh đến Văn phòng thám tử. Anh ta đang điều tra vụ tai nạn mà Yamato có liên quan, vụ tuyết lở, và nói rằng tên của Kogorō có trong báo cáo điều tra đó. Kogorō đồng ý gặp anh ta vào một ngày sau đó, và Conan đi theo anh ta, nhưng khi họ đến địa điểm họp, tiếng súng đột nhiên vang lên...

Lời hứa không được thực hiện và hồi tưởng lưu lại trong đôi mắt chết chóc. Một bí ẩn trắng xóa bắt đầu ở những ngọn núi bị bão tuyết tấn công...",2,2
20,Tiệc trăng máu,Nguyễn Quang Dũng,175[20],2020,"Phim xoay quanh một nhóm bạn thân thiết ở độ tuổi tứ tuần cùng hội tụ vào buổi tiệc tân gia tại căn hộ penthouse sang trọng của cặp vợ chồng giàu có Nguyệt Ánh (Hồng Ánh) - Ngọc Quang (Hứa Vĩ Văn). Tại đây, cả nhóm đã tổ chức trò chơi công khai toàn bộ nội dung mà họ nhận được trên điện thoại trong thời gian bữa tiệc diễn ra. Và từ đây, các bí mật, góc tối của mỗi nhân vật dần được phơi bày. Quang, Bình (Thái Hòa), Linh (Kiều Minh Tuấn) và Mạnh (Đức Thịnh) là nhóm bạn thân đã gắn bó hơn 30 năm. Một ngày nọ, cả nhóm được Quang mời đến dự tiệc tân gia tại căn hộ của vợ chồng anh. Bình dẫn theo vợ, quản trị một trang hâm mộ thơ, Thu Quỳnh (Thu Trang); Linh đi cùng vợ sắp cưới là bác sĩ thú y Kathy (Kaity Nguyễn); còn Mạnh đến một mình. Ánh - vợ của Quang - bày ra một trò chơi gọi là ""công khai bí mật"": tất cả mọi người để điện thoại lên bàn, người nào nhận được tin nhắn và cuộc gọi đến, thậm chí cả email thì đều phải chia sẻ cho những người còn lại cùng biết. Một vài người ngần ngừ, nhưng dần rồi đều chấp nhận tham gia trò chơi. Lúc đầu, đây dường như là một trò chơi vô hại, khi mà mọi người có vẻ đều khá hiểu nhau, không có gì phải giấu. Chưa kể mọi người còn trêu đùa nhau khi chơi. Dần dần, các cuộc gọi và tin nhắn dần trở nên nhạy cảm hơn, hé lộ nhiều chuyện khó xử. Quang tâm sự với Bình rằng anh đang nợ ngân hàng 50 tỷ đồng và căn hộ sang trọng của vợ chồng anh sắp bị siết nợ. Ba của Ánh gọi cho cô, nói rằng ông đã liên hệ một bác sĩ nổi tiếng để cô hẹn lịch làm phẫu thuật nâng ngực, đồng thời thể hiện ông vẫn coi thường Quang. Ánh không muốn Quang phẫu thuật cho mình vì sợ chồng mất cảm xúc tình dục với mình. Bình đề nghị đổi điện thoại với Mạnh vì cô bồ trên mạng của anh sắp gửi ảnh nóng cho anh, nhưng Mạnh đã từ chối. Quỳnh nói với Ánh rằng Quang đã từng đi điều trị tâm lý mà không cho Ánh biết. Một người bạn trong hội thơ gọi cho Quỳnh, làm lộ việc Quỳnh thường nói xấu Ánh với bạn bè mình. Lát sau, sân golf Long Thành gửi tin nhắn cho Quang, Bình và Linh, ba người này lên kế hoạch đi đánh golf mà không rủ Mạnh. Bình nhân lúc Mạnh không để ý đã đổi điện thoại của hai người. Khi bồ của Bình gửi ảnh nóng đến, Mạnh đã nổi giận đập nứt màn hình điện thoại của Bình. Quỳnh nhận được thư email từ viện dưỡng lão, tiết lộ việc cô muốn đưa mẹ của Bình vào viện dưỡng lão. Bạn trai cũ của Kathy khiến Linh hiểu nhầm khi nhắn tin hỏi về quy trình mát-xa cho chó. Sau đó Ánh Dương - con gái của Quang và Ánh - gọi cho Quang, xin phép đi chơi riêng qua đêm ở Vũng Tàu với bạn trai. Mọi chuyện bắt đầu căng thẳng khi Vân - người yêu đồng tính của Mạnh - gọi đến nói Mạnh là người đồng tính, nhưng do Bình đang giữ điện thoại của Mạnh nên mọi người nghĩ Bình là người đồng tính. Quỳnh nổi giận đập vỡ ly rượu khiến cô chảy máu tay. Một người bạn của Linh gọi đến nói về chiếc nhẫn và đôi bông tai mà Linh đặt để tặng Kathy, nhưng Kathy chỉ nhận được nhẫn mà không có bông tai (thực ra Linh đã dan díu với Ánh và tặng đôi bông tai cho cô). Chiếc điện thoại thứ hai của Linh bị lộ, cô quản lý nhà hàng của Linh gọi đến, tiết lộ việc Linh vụng trộm với cô ta và cô ta đã có thai. Một fan hâm mộ của Quỳnh nhắn tin hỏi cô đang mặc quần lót màu gì, làm Bình ghen và hai vợ chồng tranh cãi. Trước khi rời đi, Quỳnh tiết lộ rằng cô chính là người từng lái xe gây tai nạn, Bình đã nhận tội thay cô khiến anh bị tước bằng lái. Mạnh thú nhận mình là người đồng tính, nói rằng sẽ không giới thiệu Vân vì sợ ánh mắt kỳ thị của những người bạn. Mạnh và Bình đều ra về. Kathy đặt chiếc nhẫn lên bàn rồi bỏ đi, Linh đuổi theo cô. Cuối cùng chỉ còn lại vợ chồng Quang và Ánh trong căn hộ. Mọi người dần rời bữa tiệc, họ cư xử với nhau như chưa từng có việc gì xảy ra. Các cặp đôi vẫn có mỗi quan hệ như lúc đầu bữa tiệc. Trò chơi thực ra chưa hề diễn ra, và mọi người đều quay lại với cuộc sống và những góc tối của cá nhân mình.",0,0
21,Địa đạo: Mặt trời trong bóng tối,Bùi Thạc Chuyên,173,2025,"Năm 1967, chiến tranh Việt Nam đang diễn ra rất ác liệt khi quân đội Mỹ triển khai chiến dịch Cedar Falls quy mô lớn nhằm vào các căn cứ của Mặt trận Dân tộc Giải phóng miền Nam Việt Nam. Tại căn cứ Bình An Đông, một đội du kích gồm 21 người gan dạ dưới sự chỉ huy của Bảy Theo đang ngày đêm chiến đấu và bám trụ để chống giặc, ngày qua ngày họ sống ngay dưới lòng địa đạo Củ Chi. Một ngày nọ, họ bắt được Tư Đạp – một người đàn ông không rõ lai lịch thâm nhập vào vùng chiến sự. Tư Đạp kể rằng mẹ của anh là bạn thời thơ ấu của mẹ của nữ du kích Ba Hương, đồng thời nói rằng anh đã bắn hạ một máy bay trinh sát Mỹ với lý do giúp quân du kích lấy nhôm bán. Bảy Theo cho phép Tư Đạp tạm thời ở trong một căn hầm riêng. Một lúc sau, cán bộ trưởng Hai Thưng khi tới địa đạo đã phát hiện ra sự có mặt của Tư Đạp và muốn bắt anh đi, nhưng Tư Đạp đã chứng minh mình là người đáng tin tưởng khi chế được loại mìn gạt chống tăng có thể giúp đội du kích tiêu diệt xe tăng của Mỹ. Tư Đạp được ở lại để chế tạo vũ khí, còn Ba Hương qua làng bên để xác minh danh tính của anh. Kết quả là mọi chuyện đều đúng như lời anh nói, ngoại trừ việc hứa hôn của hai gia đình, đồng thời cô còn biết được anh thực chất là một công binh chuyên chế tạo những vũ khí, do một lần từng vô tình làm chết ba cán bộ nên anh đã phải trốn đến Bình An Đông để cư ngụ. Mặc dù trên danh nghĩa là bảo vệ kho lương thực và đạn dược trong địa đạo, song nhiệm vụ chính của quân du kích là phải bảo vệ cho các buổi truyền tin của đội thông tin tình báo chiến lược N38 do Hai Thưng chỉ huy. Khi phát hiện ra tín hiệu truyền tin, lực lượng quân đội Mỹ đã đổ quân đến để truy lùng quân du kích. Trong một trận càn của quân Mỹ, Sáu Lập đã bị thiêu cháy bởi súng phun lửa từ xe tăng, còn Lục Tạc chết do trúng bom tên lửa của địch. Nhằm dìm chết quân du kích để họ phải ngoi đầu ra ngoài, quân Mỹ đã bơm nhiều nước tràn ngập vào địa đạo. Trong lúc nguy cấp, Út Khờ bình thản tiết lộ với Ba Hương rằng cô đã có bầu do bị một đồng đội không rõ mặt cưỡng hiếp trong phiên canh gác của cô. Bảy Theo sau đó đã dùng khẩu B40 phá hủy máy bơm nước, giải cứu hai cô gái kịp lúc. Hôm sau, Ba Hương xin chú Sáu – cán bộ cấp cao của quân du kích – tổ chức đám cưới cho Bảy Theo và Út Khờ, sau đó dưới sự sắp xếp của chú Sáu, Út Khờ, Ba Hiếu, Bảy Sắt, và Cấm – con gái của Bảy Theo – buộc phải rời đi cùng ông để lẩn trốn. Thời gian này, Tư Đạp và Ba Hương bắt đầu nảy sinh tình cảm với nhau. Sáng hôm sau, quân Mỹ mở đợt tấn công tiếp theo và cho xe ủi đất vào trận địa. Trong lúc chui vào địa đạo để trốn, chú Sáu chẳng may bị bom của địch làm trọng thương không thể chạy được, nên ông đành tự sát bằng lựu đạn trước mặt toán lính Mỹ, còn Út Khờ và Cấm cũng đã chết do trúng khí độc của kẻ địch. Mọi chuyện ngày càng nghiêm trọng hơn khi quân Mỹ cử hai tên lính chuột cống vào địa đạo tìm diệt quân du kích, điều này khiến cho Bảy Sắt và Ba Hiếu hy sinh trong cuộc giao chiến. Sau khi hạ được một tên lính chuột cống, Bảy Theo bị bắn trọng thương, trong khi Ba Hương phải đâm chết tên lính còn lại do Tư Đạp bất ngờ xuất hiện từ dưới địa đạo lên. Cùng lúc đó, đội thông tin tình báo chiến lược N38 đã hoàn thành xong nhiệm vụ truyền tin và lập tức rời khỏi địa đạo, tạo điều kiện để cho Bảy Theo nổ mìn làm sập và chôn vùi hết địa đạo trước khi anh lâm chung. Chỉ còn lại Tư Đạp và Ba Hương còn sống sót sau đợt đột kích, cả hai đã đưa thi thể của tên lính Mỹ lên chiếc bè rồi lặn xuống sông bơi đến vùng an toàn, chuẩn bị cho cuộc chiến sắp tới. Trong phần cảnh danh đề, những cựu chiến binh từng là du kích Củ Chi đã có buổi tâm sự về những ngày tháng họ chiến đấu ở vùng đất này.",6,0
